{
  "source_id": "SRC-M-08",
  "title": "弦能增幅网络",
  "url": "https://wiki.biligame.com/klbq/%E9%A6%99%E5%A5%88%E7%BE%8E",
  "local_paths": [
    "res/WIKI/amplification_network.json"
  ],
  "publisher": "卡拉彼丘WIKI",
  "published_at": null,
  "version": "unknown",
  "accessed_at": "2026-08-14",
  "material_type": "setting",
  "canon_context": "battle",
  "context_router": {
    "primary": "battle_stage",
    "secondary": null
  },
  "language": "unknown",
  "timeline_phase": "unknown",
  "scene": "弦能增幅网络",
  "dimensions": [
    "decisions",
    "timeline"
  ],
  "characters_present": [
    "香奈美"
  ],
  "counterparties": [],
  "evidence_summary": [],
  "short_quote": [],
  "timestamp": [],
  "inference": [],
  "conflicts": [],
  "status": "candidate",
  "canon_evidence": true,
  "notes": [
    "本地索引定位到 9 项，尚未逐项检查媒体内容。",
    "当前仅为图像索引。"
  ]
}
