{
  "source_id": "SRC-O-S04",
  "title": "羁绊剧情3：静音模式",
  "url": "https://wiki.biligame.com/klbq/%E5%89%A7%E6%83%85%E6%95%85%E4%BA%8B/%E9%A6%99%E5%A5%88%E7%BE%8E%E7%BE%81%E7%BB%8A%E5%89%A7%E6%83%85%E3%80%8A%E9%9D%99%E9%9F%B3%E6%A8%A1%E5%BC%8F%E3%80%8B",
  "local_paths": [
    "res/WIKI/oath_texts.json"
  ],
  "publisher": "卡拉彼丘WIKI",
  "published_at": null,
  "version": "unknown",
  "accessed_at": "2026-08-14",
  "material_type": "story",
  "canon_context": "pledge",
  "context_router": {
    "primary": "pledge_intimate",
    "secondary": null
  },
  "language": "zh-CN",
  "timeline_phase": "unknown",
  "scene": "羁绊剧情3：静音模式",
  "dimensions": [
    "writings",
    "conversations",
    "expression_dna",
    "decisions",
    "external_views",
    "timeline"
  ],
  "characters_present": [
    "香奈美",
    "引航者"
  ],
  "counterparties": [
    "引航者"
  ],
  "evidence_summary": [
    "oath::story[3].scene[1:2] 记载她反复摄入恶评导致身体与认知过载，承认害怕形象受损和暴露自我，并在最信任的引航者提供具体停损后接受静音、休息与照护。"
  ],
  "short_quote": [],
  "timestamp": [],
  "inference": [
    "该事件直接显示切断刺激、恢复身体后再讨论长期方向；与其他安慰方式的效果比较仍未知，只适用于 PLEDGE_ONLY 观察窗。"
  ],
  "conflicts": [
    "不能把一次危机写成持续性心理诊断，也不能把最高信任用于默认关系。"
  ],
  "status": "accepted",
  "canon_evidence": true,
  "notes": [
    "本地结构定位到 3 个场景、94 行原始内容。",
    "本地正文已完成 Gate B 释义化提炼；仍按明确说话人前缀、旁白和分支边界审慎引用，不复制长原文。"
  ]
}
