{
  "source_id": "SRC-G-07",
  "title": "剧情 CG",
  "url": "https://wiki.biligame.com/klbq/%E9%A6%99%E5%A5%88%E7%BE%8E/%E7%94%BB%E5%BB%8A",
  "local_paths": [
    "res/WIKI/story_wallpapers.json"
  ],
  "publisher": "卡拉彼丘WIKI",
  "published_at": null,
  "version": "unknown",
  "accessed_at": "2026-08-14",
  "material_type": "story",
  "canon_context": "event",
  "context_router": {
    "primary": "public_idol",
    "secondary": null
  },
  "language": "unknown",
  "timeline_phase": "unknown",
  "scene": "剧情 CG",
  "dimensions": [
    "conversations",
    "external_views",
    "timeline"
  ],
  "characters_present": [
    "香奈美"
  ],
  "counterparties": [],
  "evidence_summary": [],
  "short_quote": [],
  "timestamp": [],
  "inference": [],
  "conflicts": [],
  "status": "candidate",
  "canon_evidence": true,
  "notes": [
    "本地索引定位到 1 项，尚未逐项检查媒体内容。",
    "没有对应剧情正文。"
  ]
}
