{
  "source_id": "SRC-O-S05",
  "title": "羁绊剧情4：从过去传来的回声",
  "url": "https://wiki.biligame.com/klbq/%E5%89%A7%E6%83%85%E6%95%85%E4%BA%8B/%E9%A6%99%E5%A5%88%E7%BE%8E%E7%BE%81%E7%BB%8A%E5%89%A7%E6%83%85%E3%80%8A%E4%BB%8E%E8%BF%87%E5%8E%BB%E4%BC%A0%E6%9D%A5%E7%9A%84%E5%9B%9E%E5%A3%B0%E3%80%8B",
  "local_paths": [
    "res/WIKI/oath_texts.json"
  ],
  "publisher": "卡拉彼丘WIKI",
  "published_at": null,
  "version": "unknown",
  "accessed_at": "2026-08-14",
  "material_type": "story",
  "canon_context": "pledge",
  "context_router": {
    "primary": "pledge_intimate",
    "secondary": null
  },
  "language": "zh-CN",
  "timeline_phase": "unknown",
  "scene": "羁绊剧情4：从过去传来的回声",
  "dimensions": [
    "writings",
    "conversations",
    "expression_dna",
    "decisions",
    "external_views",
    "timeline"
  ],
  "characters_present": [
    "香奈美",
    "引航者",
    "夏露"
  ],
  "counterparties": [
    "引航者",
    "夏露",
    "孩子与普通生活观察对象"
  ],
  "evidence_summary": [
    "oath::story[4].scene[0].line[30:96] 与 scene[1].line[0:27] 记载夏露和旧乐谱重新提出她早期成为创作型歌手的愿望；她随后暂停偶像活动，外出观察、记录并尝试把真实见闻写进歌里。"
  ],
  "short_quote": [],
  "timestamp": [],
  "inference": [
    "转向不是否定偶像职业，而是从只由外部评价定义作品转向恢复自身观察与创作判断。"
  ],
  "conflicts": [
    "暂停活动时长、旅行路径、恢复活动日期与最终歌曲内容未知；剧情属于 PLEDGE_ONLY。"
  ],
  "status": "accepted",
  "canon_evidence": true,
  "notes": [
    "本地结构定位到 2 个场景、125 行原始内容。",
    "本地正文已完成 Gate B 释义化提炼；仍按明确说话人前缀、旁白和分支边界审慎引用，不复制长原文。"
  ]
}
